QUEST_UNUSED_20151102_002366	Urbonas was being chased after the demons!{nl}Ashaq Underground Prison was closed for a long time.{nl}I don't know what they are trying to do..
QUEST_UNUSED_20151102_002367	{nl}Someone must go there now!
QUEST_UNUSED_20151102_002368	I will get ready to go to Ashaq Underground Prison.{nl}I want you to tell this to the lord fast!
QUEST_UNUSED_20151102_002369	"""It would take long time to send my subordinates there.{nl}I am sorry, but can you go to Ashaq Underground Prison where Pranas and Urbonas are located?{nl}I can't move so I feel stuffy.."""
QUEST_UNUSED_20151102_002370	"""If you are the Revelator which Urbonas talked about, we better go meet Urbonas fast.{nl}However, even if you are busy, you should be well prepared so go meet the item merchant.{nl}I've prepared goods which you would be able to use well."""
QUEST_UNUSED_20151102_002371	"""{nl}If your preparation gets completed, don't come to me, but please rather meet Pranas and head to Ashaq Underground Prison!"""
QUEST_UNUSED_20151102_002372	"""I've prepared it fast since the lord sent the people.{nl}I should give you a better good, but since we are in a hurry, please use it.{nl}When you use an anvil, you would be able to enhance your weapon."""
QUEST_UNUSED_20151102_002373	"""If the demons hurt Urbonas, then the next target will be Orsha.{nl}We should do our best to save Urbonas!"""
QUEST_UNUSED_20151102_002374	"""Your words are correct.{nl}The northern region where I used to stay became a ruin due to the demons.{nl}Probably, the next location will be the southern region."""
QUEST_UNUSED_20151102_002375	{nl}Orsha is the base of the southern part of the kingdom.{nl}I am sure that the demons would do something.{nl}Please go to Ashaq Underground Prison with me to save Urbonas!
QUEST_UNUSED_20151102_002376	"""I am gonna go to ask for help to the chasers.{nl}If you are ready, please come to xx region that leads to Ashaq Underground Prison at Paupys Crossing."""
QUEST_UNUSED_20151102_002377	"""They are all experienced chasers who would help me.{nl}But, it's not going to enough do it just by us.{nl}It is so fortunate that you came with us.{nl}"""
QUEST_UNUSED_20151102_002378	"""I can feel some ominous energy coming from the direction of the Underground Prison.{nl}If you are ready, let's head to Ashaq Underground Prison."""
QUEST_UNUSED_20151102_002379	I will first leave with the chasers.{nl}Please follow us right away.
QUEST_UNUSED_20151102_002380	"""It feels like something unknown is suffocating me.{nl}I can't even breathe.{nl}By the way, are you okay?"""
QUEST_UNUSED_20151102_002381	"""{nl}By seeing that you are free inside, I guess the goddesses really take care of you."""
QUEST_UNUSED_20151102_002382	"""I've been to this place a few times when I was doing training in the past.{nl}But, I never felt like something is suffocating me.{nl}Same with that ominous fog."""
QUEST_UNUSED_20151102_002383	"""{nl}Since you seem safe, can you go to the 2nd district and{nl}check what's going on?"""
QUEST_UNUSED_20151102_002384	This feeling is like a curse.
QUEST_UNUSED_20151102_002385	I've never seen an icon with a shape like that.{nl}I think the demons have some other objective.{nl}I can't do anything at the moment so I am very grateful{nl}that you've destroyed the icon for me.
QUEST_UNUSED_20151102_002386	"""{nl}There is a possibility that the bishop and his brothers are hiding in the hidden room.{nl}Since we can't do anything, you should go there alone.{nl}Are you going to be okay?"""
QUEST_UNUSED_20151102_002387	"""If possible, I want you to eliminate all the icons.{nl}If they remain, we can't run away even if our brothers are alive."""
QUEST_UNUSED_20151102_002388	"""This place is old and mazed so if we go into a wrong way, we may not be able to go up.{nl}Please be careful."""
QUEST_UNUSED_20151102_002389	"""So you've come here with Pranas?{nl}You've entered into a deadly place in order to save me.. I am too sorry to see my dead disciples.{nl}Recently, when my disciple, Iruma was doing training, he found a sheet of order.{nl}It contained the plans of the demons to annihilate Orsha."""
QUEST_UNUSED_20151102_002390	{nl}I gathered my disciples and met with Irma to try and analyze the document.{nl}But since then we've been constantly under attack by the demons.{nl}The document says that Demon Goddess Giltine is trying to kill all Revelators. {nl}So our order came here to hide and prepare to meet and guide the destined Revelator.
QUEST_UNUSED_20151102_002391	"""{nl}{nl}We had no way of telling Lord Inesa, however.{nl}If we left any traces the demons would find us and we thought that would be the end of us.{nl}My disciples and I ended up hiding here, trying to avoid the demons.{nl}But there was something we missed."""
QUEST_UNUSED_20151102_002392	"""{nl}We were being chased by no ordinary demon, but a Demon Lord.{nl}This Demon Lord, Marnox, set up statues of himself to control the prison{nl} and had his vassals close in on us to keep us from escaping.{nl}We thought soon it would be over for us."""
QUEST_UNUSED_20151102_002393	"""{nl}The priests are hiding in levels 2F and 3F.{nl}A few priests went missing, and Irma and I met Marnox trying to escape from the hidden room where we hid the Demon Orders.{nl}Irma was caught by Marnox, while I managed to escape and was ready to die by now."""
QUEST_UNUSED_20151102_002394	"""{nl}But if Inesa sent you here, there is still hope.{nl}There is no doubt you are the Revelator we have been waiting for."""
QUEST_UNUSED_20151102_002395	"""If you are a Revelator, step onto our magic circle.{nl}If your status is confirmed, then you can face the Demon Lord."""
QUEST_UNUSED_20151102_002396	Don't be afraid.{nl}The goddesses will lead your way.
QUEST_UNUSED_20151102_002397	The efforts of our order were not in vain.{nl}Revelator...
QUEST_UNUSED_20151102_002398	"""{nl}Only you can face Demon Lord Marnox now.{nl}Please, save our priests and the people of Orsha."""
QUEST_UNUSED_20151102_002399	"""Revelator, thanks to you destroying the statues Pranas is now able to move.{nl}I'm old and will be nothing but a burden to you; go with Pranas and Irma and save the priests.{nl}Please."""
QUEST_UNUSED_20151102_002400	I can't escape on my own and leave the priests behind.{nl}We need to find the Demon Orders. {nl}We need to analyze it and figure out the demons' invasion plans.
QUEST_UNUSED_20151102_002401	The bishop is alive!{nl}I'm so glad to hear that.{nl}And you really are a Revelator.{nl}The goddesses are on our side.
QUEST_UNUSED_20151102_002402	"""There's a sinister energy hanging over this place.{nl}Still, I want to be useful to our employer...{nl}I know you must be busy, but if you're headed to region 1, will you{nl}defeat some demons there and get something for me?{nl}Something safe."""
QUEST_UNUSED_20151102_002403	You seem to be in better condition than us.
QUEST_UNUSED_20151102_002404	I don't know what they'll do with this but at least it won't look like I'm slacking off on the job.{nl}Thank you.
QUEST_UNUSED_20151102_002405	All the agents outside asked me to get something for them.{nl}Honestly I have no interest in these things...{nl}But since they asked I guess I'll have to do it.
QUEST_UNUSED_20151102_002406	"""{nl}I'm going to look for what I can; if you happen to face some demons in region 2{nl}will you get something from them, too?"""
QUEST_UNUSED_20151102_002407	"""Isn't it better to capture the demons instead, though?{nl}That is, assuming you can catch them, of course."""
QUEST_UNUSED_20151102_002408	"""A wooden piece.{nl}Is it an amulet? I wonder what they can do with this...{nl}Well, it's better than nothing."""
QUEST_UNUSED_20151102_002409	"""I hear from the agents that the demons have a kind of sack they carry around with them.{nl}I wonder if these sacks don't have something to do with how they can live in these terrible conditions.{nl}If you go to region 3, get some after you defeat the demons and try and use the sacks.{nl}Who knows, they could be useful for yourself, too."""
QUEST_UNUSED_20151102_002410	I came to help with the maintenance work but look at what almost happened.{nl}You really can't trust anyone outside the church.
QUEST_UNUSED_20151102_002411	This could be very useful.{nl}I ought to show it to the agents as soon as I get outside.
QUEST_UNUSED_20151102_002412	"""So the brothers are all hiding in the level below.{nl}Let's go, then."""
QUEST_UNUSED_20151102_002413	"""If Draznie and Auranas are safe, that means the other brothers can still be alive.{nl}But it's the same thing here.{nl}There's cursed idols everywhere.{nl}We really need to get rid of them as soon as we can...{nl}"""
QUEST_UNUSED_20151102_002414	"""According to Draznie, there's a cursed totem in region 2.{nl}Will you take it down?{nl}It will be easier to look for Irma in region 3 after that."""
QUEST_UNUSED_20151102_002415	The bishop is very fond of Irma.{nl}She needs to be alive...
QUEST_UNUSED_20151102_002416	You destroyed the statue?{nl}It's such a relief to hear that.
QUEST_UNUSED_20151102_002417	Now please look for traces of Irma in region 3.{nl}Let us hope she's still alive...
QUEST_UNUSED_20151102_002418	"""Revelator, you are the only one our order can depend on.{nl}The same goes for the Lord and the residents of Orsha."""
QUEST_UNUSED_20151102_002419	What happened...?{nl}I thought the Demon Lord had killed me...{nl}Where are we?
QUEST_UNUSED_20151102_002420	"""So the statues were the reason why we couldn't move.{nl}I saw them in regions 4 and 5 when the bishop and I were trying to avoid the Demon Lord.{nl}The ones I saw looked a little different, but it seems like Marnox set them up to spy on us."""
QUEST_UNUSED_20151102_002421	"""{nl}Will you take down the statues in regions 4 and 5?{nl}If we don't, no matter where we go we will never escape from Marnox's grip..."""
QUEST_UNUSED_20151102_002422	"""Before I was caught by the Demon Lord, the bishop told me all about the fate of our order.{nl}Revelator, I am truly glad to have met you."""
QUEST_UNUSED_20151102_002423	Irma went down to the third floor.{nl}She told me to send you there when you came back.
QUEST_UNUSED_20151102_002424	{nl}I don't think I can move from here.{nl}I'm afraid you'll have to go on your own.
QUEST_UNUSED_20151102_002425	"""Irma said she was going to the third floor to find Gelija.{nl}She's Irma's sister so I couldn't even try to stop her.{nl}She knows we can't do anything without you here,{nl}I don't know why she's acting like this."""
QUEST_UNUSED_20151102_002426	{nl}Find Irma before the Demon Lord finds her again.
QUEST_UNUSED_20151102_002427	Irma told me.{nl}That you came all the way here from Orsha to find us.{nl}I'm not afraid now that I know a Revelator is with us.
QUEST_UNUSED_20151102_002428	Irma is too reckless and that's a problem.
QUEST_UNUSED_20151102_002429	The bishop was very worried.{nl}There were of course many places to meet with a Revelator other than here.{nl}Draznie and I were in charge of this prison so we made a lot of preparations for a future crisis here.
QUEST_UNUSED_20151102_002430	"""{nl}Originally we simply planned to avoid any difficult enemies, but since you're here{nl}we should make use of our hidden tools.{nl}I left some bags of pearl powder in region 1.{nl}If you collect this powder we can use it against the demons.{nl}I'll tell you how after you bring back the powder."""
QUEST_UNUSED_20151102_002431	Once again I'm in awe with our bishop's sense of foresight.{nl}If he hadn't prepared this we would have been left at the hands of the demons.{nl}I hope the missing brothers are at the other hideouts we prepared.
QUEST_UNUSED_20151102_002432	This is more than enough.{nl}Thank you.
QUEST_UNUSED_20151102_002433	The demons aren't simple monsters; they seem to have a command hierarchy.{nl}The stronger ones commanding the weaker ones.{nl}I wonder if defeating the strong ones won't make it easier to take down the rest.
QUEST_UNUSED_20151102_002434	{nl}Take this pearl powder and use it whenever you see a demon.{nl}The light coming from the power will point to the strongest demon monsters so you can tell who they are.
QUEST_UNUSED_20151102_002435	We still don't know if someone's leading the demons{nl}but if we take them down one by one won't the world become safe again?
QUEST_UNUSED_20151102_002436	Thank you.{nl}Did you deal well with the demons?{nl}There are many other things prepared but this is all I have...{nl}Draznie will have to take care of the rest.
QUEST_UNUSED_20151102_002437	Auranas and I found several safe spots around this prison.{nl}Of course the one where we are now is not one of them.{nl}I was hiding in region 3 but the Demon Lord came with his vassals to look around the area.{nl}I had to leave all my things behind and escape.
QUEST_UNUSED_20151102_002438	"""{nl}We should find that spot again if we're going to stay here a little longer...{nl}But as you can see all we can do is run.{nl}If that's fine with you, will you clear out region 3?"""
QUEST_UNUSED_20151102_002439	I guess the demons didn't expect us to be hiding there...
QUEST_UNUSED_20151102_002440	{nl}The problem is we didn't expect them to go all the way there either.
QUEST_UNUSED_20151102_002441	Thank you.{nl}I should have a look around and hide in region 3 again.
QUEST_UNUSED_20151102_002442	In region 4 there are several small rooms.{nl}I made traps in them with the technique I learned while working in the northern region. {nl}The have an image of me to lure the enemy.
QUEST_UNUSED_20151102_002443	"""{nl}But I can't go all the way there.{nl}If it's fine with you, will you go there and activate the traps?"""
QUEST_UNUSED_20151102_002444	I have several other traps and hideouts outside this prison.{nl}I prepared enough for everyone in case something happens to Orsha.
QUEST_UNUSED_20151102_002445	"""Did it work well on the demons?{nl}I had never used it on demons before, so I was worried.{nl}But I'm glad to hear it went well."""
QUEST_UNUSED_20151102_002446	Go see Irma now.{nl}She's preparing to take back the Demon Orders.
QUEST_UNUSED_20151102_002447	"""I'm sorry for disappearing without notice.{nl}It was urgent. While you were destroying the surveillance statue{nl}I managed to escape without Marnox noticing.{nl}But it seems he has more statues here, too."""
QUEST_UNUSED_20151102_002448	"""Many brothers were sacrificed to reach where we are.{nl}Because this is the only path we can take.{nl}Please, stop the demons."""
QUEST_UNUSED_20151102_002449	"""To enter the hidden room and get the orders, you'll have to destroy the statue in region 2. {nl}But remember not to use a transport device in its range or Marnox will catch you.{nl}Can you do it?"""
QUEST_UNUSED_20151102_002450	"""This is strange, he should be here any minute now...{nl}Are you afraid?"""
QUEST_UNUSED_20151102_002451	"""This is very strange.{nl}Why isn't Marnox here?{nl}From his behaviour so far, I would assume he'd come..."""
QUEST_UNUSED_20151102_002452	"""If Marnox doesn't come, there's nothing we can do.{nl}Just in case, I think it would be good to destroy the statue in region 3 to provoke him.{nl}As long as he lives we will never be able to open the door to the hidden room."""
QUEST_UNUSED_20151102_002453	"""The bishop can't have been found, can he? {nl}I remember he acted so brazen when he had me caught, nothing like now.{nl}I remember how lowly he regarded priests like me...{nl}Revelator, are you afraid?"""
QUEST_UNUSED_20151102_002454	"""He might have sent his vassals and escaped, he could be making other plans.{nl}We can't waste any more time, let's open the door."""
QUEST_UNUSED_20151102_002455	I'll open the door and you'll enter the room. {nl}Let's get the orders and go back to the bishop immediately.
QUEST_UNUSED_20151102_002456	You defeated Marnox...{nl}I don't think I will be able to move for a while.
QUEST_UNUSED_20151102_002457	"""It was an honor defending the fate of our order until the end.{nl}It was all thanks to you.{nl}I'm going to hide here and recover, you take the orders and go see the bishop."""
QUEST_UNUSED_20151102_002458	Do you mean you defeated Marnox?{nl}A Demon Lord... You truly have the power of a Revelator.{nl}I'm glad the priests are safe...{nl}I will talk to Inesa and make sure those who are missing return to their homes.
QUEST_UNUSED_20151102_002459	People will remember you when Orsha prospers once again...
QUEST_UNUSED_20151102_002460	I'm going to return to Orsha and work on the Demon Orders analysis.{nl}You go see the Lord and tell her about Marnox and us.{nl}My disciples are staying here to make sure there's no traces of Marnox left and to find the missing priests.
QUEST_UNUSED_20151102_002461	"""So the demons reached the areas surrounding Orsha.{nl}We were always wary of demon invasions, but we never thought we'd have to face a Demon Lord.{nl}If only I could praise your feat to the people..."""
QUEST_UNUSED_20151102_002462	"""{nl}I'm sorry. If I told everyone about it, it would only scare the residents."""
QUEST_UNUSED_20151102_002463	I heard about what happened.{nl}Urbonas confirmed you are a Revelator sent by the goddesses.{nl}It is an honor to meet the hero of the legend passed down in our family.{nl}It seems the goddesses haven't left us yet.{nl}What are your plans now?
QUEST_UNUSED_20151102_002464	"""{nl}For now, you should go see Urbonas.{nl}He's looking for you."""
QUEST_UNUSED_20151102_002465	Please think of Orsha as your second home.{nl}I and the residents of Orsha are always glad to welcome you.
QUEST_UNUSED_20151102_002466	"""Welcome. We were just finishing the analysis. {nl}There's a few parts here and there we can't agree on, but here's what we have."""
QUEST_UNUSED_20151102_002467	{nl}{nl}(Demon Orders analysis)
QUEST_UNUSED_20151102_002468	We mustn't assume all the missing brothers are dead.{nl}But to find them we need to destroy Marnox's statues.{nl}Would you take care of that?
QUEST_UNUSED_20151102_002469	Someone has to be alive...
QUEST_UNUSED_20151102_002470	Thank you.{nl}I'll go find them as soon as I recover from my injuries.
QUEST_UNUSED_20151102_002471	There's no way to know where the brothers are hiding in this prison...{nl}And there'll be priests that won't be able to return to their families even after all of this is over...{nl}I wish I could bring them their belongings at least.
QUEST_UNUSED_20151102_002472	{nl}Several priests went missing in region 2.{nl}Will you look for their bags there?
QUEST_UNUSED_20151102_002473	"""Not all of the bags will belong to missing people.{nl}I lost mine too, after all..."""
QUEST_UNUSED_20151102_002474	"""Thank you. You found my bag that was lost, too.{nl}Seeing the diaries inside the bags makes me think many of the brothers are still alive. {nl}We need to find them before it's too late."""
QUEST_UNUSED_20151102_002475	There's a reason you cover your hands when you throw away something dirty.{nl}Priest Irma destroyed Marnox's cursed idols when she was running away from him.{nl}But now their remains are spread aroun all overd.{nl}Their energy could still come back and hurt us.
QUEST_UNUSED_20151102_002476	{nl}Here's a cloth soaked in holy water. Use it to get rid of what remains of the statue.{nl}Cover the fragments with the cloth and the power of the holy water will make them disappear.
QUEST_UNUSED_20151102_002477	Rushing anything is bound to end in trouble eventually.
QUEST_UNUSED_20151102_002478	"""That's one less thing to worry about. {nl}Although, with how the demons left this place, it's going be a while before it can be back to normal."""
QUEST_UNUSED_20151102_002479	Would you go to the Uzali Crossroads and hunt some Green Lepusbunny Assassins?{nl}We could use their warm fur.
QUEST_UNUSED_20151102_002480	Around here there are Blue Siaulav Mages that carry emergency food.{nl}Horace probably told you their food is surprisingly edible. Could you get some for me?
QUEST_UNUSED_20151102_002481	"""It's funny, if it weren't for them I would have starved by now.{nl}Because of the cold, the only thing that grows around here are potatoes."""
QUEST_UNUSED_20151102_002482	First we need to do something about the heat.{nl}Horace once said that Blue Lapasape mushrooms generate heat; I want to test them.
QUEST_UNUSED_20151102_002483	"""Let's see if you're skilled, then.{nl}Go to Paupys Crossing and take down ten Lapflammers and ten Lapemans."""
QUEST_UNUSED_20151102_002484	You seem strong enough already.{nl}I just need to check how well you're able to use that strength of yours.
QUEST_UNUSED_20151102_002485	"""Good. You have fulfilled the most basic condition.{nl}Us Peltasta are a class that uses the shield actively against our opponents. {nl)As such, you're required to have a basic understanding of it."""
QUEST_UNUSED_20151102_002486	"""I'm going to ask you for some materials for your shield.{nl}First you can go to Paupys Crossing and collect metal decorations from Lapemans.{nl}Also, gather some dry wood from an isolated worshop there."""
QUEST_UNUSED_20151102_002487	You did well.{nl}Now gather all the materials you need and craft your own shield.
QUEST_UNUSED_20151102_002488	I'm simply following the Master's important orders.{nl}That doesn't mean I'm jealous of you for being a traveler!
QUEST_UNUSED_20151102_002489	"""Of course, first you'll have to prove you can handle advanced techniques."""
QUEST_UNUSED_20151102_002490	Take this and defeat the monsters in Bracken Forest 63_3.{nl}You'll see the numbers here go up the more enemies you defeat.{nl}Demons are worth twice the points.
QUEST_UNUSED_20151102_002491	"""There are a few conditions, though.{nl}One, you must defeat the enemy with a shield equipped. {nl}Two, if you become incapable of combat, the enemies you defeated until then will not count."""
QUEST_UNUSED_20151102_002492	"""{nl}Finally, you have to defeat the monsters without any help from your allies."""
QUEST_UNUSED_20151102_002493	Defeat monsters with your shield equipped. {nl}This will prove your survival skills.{nl}Note that catching demons will be more effective.
QUEST_UNUSED_20151102_002494	"""Teaching you how to use the spear is easy, what's important is your attitude.{nl}There's a place that's just right for learners like you."""
QUEST_UNUSED_20151102_002495	The most important virtue of a warrior is their sense of combat.{nl}That means attacking anything that's hostile to what you're trying to protect.{nl}Give it a try; defeat the Yognomes in Bracken Forest 63_3.
QUEST_UNUSED_20151102_002496	Did you hear?{nl}Some of the refugees that were coming to Orsha got hurt around the Lemprasa Pond and were left behind.{nl}They need to be rescued!
QUEST_UNUSED_20151102_002497	I'm glad nothing worse happened to them.{nl}It was all thanks to your help.{nl}I think it's clear you're ready to move on to the final level of Cleric.
QUEST_UNUSED_20151102_002498	The first herbs you will find in the XXX region under piles of leaves.{nl}The second herbs grow in the YY region.{nl}The third are blooming yellow flowers in region ZZ; they should be the easiest to find.
QUEST_UNUSED_20151102_002499	"""The master herself, too, got in after making her own Bokor doll.{nl}I guess you can say it's part of our history and tradition."""
QUEST_UNUSED_20151102_002500	I would say this is a very high quality Bokor doll!{nl}It really seems like you're a natural. {nl}Now you too are a Bokor. Welcome!
QUEST_UNUSED_20151102_002501	What is it?
QUEST_UNUSED_20151102_002502	"""Oh... if you mean a strong-willed Dievdirbys, yes, I know her.{nl}But I'm afraid I'm at a loss here. I have no chisel or any materials to make one."""
QUEST_UNUSED_20151102_002503	Alright. Then prove you're ready to learn some advanced techniques.{nl}Show me how much you've mastered the basics.
QUEST_UNUSED_20151102_002504	"""Any monster is fine, as long as you use your Highlander techniques to defeat them.{nl}Do this without the help of your colleagues."""
QUEST_UNUSED_20151102_002505	Looks like you have no problems in defeating demons.{nl}But you still need some practice for the more vicious ones.{nl}I can show you the way of a true Peltasta.
QUEST_UNUSED_20151102_002506	"""If you meet the requirements, that is."""
QUEST_UNUSED_20151102_002507	I once was asked to get rid of the Chapparition in Karolis Springs.{nl}I couldn't finish the job at the time but now I think it could be a good test for you.{nl}Go to Karolis Springs and defeat the Chapparition there.
QUEST_UNUSED_20151102_002508	"""I'm surprised by how much you improved.{nl}I can tell you're different from other Hoplites. {nl}You'll have no problems in becoming even stronger. So, are you ready for the next stage?"""
QUEST_UNUSED_20151102_002509	"""Yes, that's the end of the spear I used to attack it back then.{nl}Now we can finally say it was us the Hoplites who defeated the beast."""
QUEST_UNUSED_20151102_002510	"""And of course, don't ask your friends to help you with this."""
QUEST_UNUSED_20151102_002511	I like your guts.{nl}Do me a favor and defeat the demons in Feretory Hills.
QUEST_UNUSED_20151102_002512	"""After Medzio Diena, Feretory Hills has been crawling with demons.{nl}Go and defeat the demons there."""
QUEST_UNUSED_20151102_002513	"""Take this gem and go to Feretory Hills.{nl}After you injure the monsters, use the power of the gem to purify them.{nl}Then, bring back their ashes."""
QUEST_UNUSED_20151102_002514	This effectively proves your skills. {nl}Congratulations on reaching the last level of Krivis.{nl}I hope you will keep using your power to help those in need.
QUEST_UNUSED_20151102_002515	Go to Braken Monastery 64_2 and you will see Sparnasman monsters.{nl}Defeat them in the XXX region and bring me their horns.
QUEST_UNUSED_20151102_002516	I'm going to give you my energy.{nl}Use the energy at Feretory Hills and it will blend in with part of the monsters' spirits.
QUEST_UNUSED_20151102_002517	"""Defeat the monsters with my energy imparted to collect their spirits, then bring them to me. {nl}Do this without the help of anyone."""
