QUEST_UNUSED_20151022_001008	See you again later.{nl}You are going to repair your equipment here from now on right?
QUEST_UNUSED_20151022_001009	Welcome!{nl}The best equipment shop in Orsha!{nl}
QUEST_UNUSED_20151022_001010	Chisel?{nl}Are you talking about the chisel which Ilanai has given to you?{nl}
QUEST_UNUSED_20151022_001011	Good. Receive it.{nl}I guess your religious belief in the goddesses is strong.
QUEST_UNUSED_20151022_001012	Jura has the chisel.{nl}She works at the equipment shop.
QUEST_UNUSED_20151022_001013	"""Oh, you've made it well according to the order.{nl}Now, I guess I can get to work."""
QUEST_UNUSED_20151022_001014	Do you still have things to order?{nl}You can just take a look around so please visit here often.
QUEST_UNUSED_20151022_001015	Have you found the chisel?{nl}I welcome orders like this so please keep visit our shop.
QUEST_UNUSED_20151022_001016	What do you think?{nl}Why don't you help us if you think eliminating demons is important even if our objectives are different from each other.
QUEST_UNUSED_20151022_001017	"""First of all, there are many polluted tombstones.{nl}I will break these so I want you to break the polluted tombstone at Usas Hill.{nl}"""
QUEST_UNUSED_20151022_001018	I think that tombstone is also spurting out the red energies.{nl}Like the tombstone beside. That's the proof of the pollution.
QUEST_UNUSED_20151022_001019	I can't understand.{nl}Albinas? Are you the member of the Anastos?{nl}That doesn't make sense?{nl}
QUEST_UNUSED_20151022_001020	I'm not saying I know everyone from the Anastospa...{nl}But we used to be part of the same Order so I know them well.{nl}
QUEST_UNUSED_20151022_001021	"""No way, bring him here at once! {nl}I'll have to hear from him myself!"""
QUEST_UNUSED_20151022_001022	"""When you have enough stones, go see Eduinas at the Nestospa camp.{nl}He'll use them to make stones for construction.{nl}"""
QUEST_UNUSED_20151022_001023	"""Eduinas won't be happy if he finds out you made this tombstone, though.{nl}Just keep that in mind if you want to take responsibility."""
QUEST_UNUSED_20151022_001024	"""While I am polishing up the materials, I don't want to see your face.{nl}How about defeating the monsters that make the place around here messy."""
QUEST_UNUSED_20151022_001025	"""Since everything is done, go back to Damijonas with this.{nl}Do not ever do it again."""
QUEST_UNUSED_20151022_001026	"""You've got it. Now, I will start the recovery.{nl}It is fortunate that the damage wasn't severe."""
QUEST_UNUSED_20151022_001027	"""We and the Anastospa have different opinions, but we are not hostile to each other.{nl}Ever since the unknown name came out, it's apparent that we suspect it.{nl}"""
QUEST_UNUSED_20151022_001028	"""And you even broke the tombstone.{nl}Anyways, since you've done your responsibility, I will forgive you.{nl}"""
QUEST_UNUSED_20151022_001029	"""Don't you feel it's unfair to just let it go?{nl}Since there's a camp of Anastospa up there, go there and ask.{nl}It's really strange."""
QUEST_UNUSED_20151022_001030	"""Yes, I am Anastos'... yes that's right.{nl}What brought you here?{nl}"""
QUEST_UNUSED_20151022_001031	"""Sorry, I can't answer your questions at the moment since I am too busy at the moment..{nl}If you can find my research documents, I may get some spare time..."""
QUEST_UNUSED_20151022_001032	"""Instead of blind devotion, a life of eliminating demons and preparing for chaos..{nl}I mean those kind of things.{nl}"""
QUEST_UNUSED_20151022_001033	This is truly strange.{nl}I should send one of my colleagues to find it out.
QUEST_UNUSED_20151022_001034	"""Ah, by the way, I am thinking about giving him a flare to prepare for any danger, but{nl}There aren't any adequate flares.{nl}"""
QUEST_UNUSED_20151022_001035	Can you get us the powders that burn well in the fire?{nl}There are so many monsters around so it won't be hard to obtain the materials.
QUEST_UNUSED_20151022_001036	Let's wait for the investigation results.{nl}He is a competant lad so he will find it out soon.
QUEST_UNUSED_20151022_001037	"""Since we can't just stand still, how about we find it out ourselves as well?{nl}"""
QUEST_UNUSED_20151022_001038	Good. Barte may have seen something.{nl}He recently joined our camp.{nl}
QUEST_UNUSED_20151022_001039	How about you ask her about Albinas?{nl}
QUEST_UNUSED_20151022_001040	Albinas?{nl}I saw someone with the apperances like your explanations near Majiva Grave Field.{nl}
QUEST_UNUSED_20151022_001041	"""When you go back to Majiva Grave Field, that leather may be still there.{nl}I... even if the goddesses tell me to go, I can't since I am too scared."""
QUEST_UNUSED_20151022_001042	What's the matter?{nl}I can't think anyone who would use that pattern except for the servant of Vaiga.{nl}
QUEST_UNUSED_20151022_001043	We better let other people know this fast.{nl}You let Gedas know!{nl}
QUEST_UNUSED_20151022_001044	"""Please, save Fabijus!{nl}Ah, before that, we better go back to Nestospa!{nl}"""
QUEST_UNUSED_20151022_001045	"""This holy water, please take it.{nl}You will get at least one chance of using it on the demons.{nl}"""
QUEST_UNUSED_20151022_001046	So you were safe.{nl}I've heard about Albinas from Fabijus.{nl}
QUEST_UNUSED_20151022_001047	Do you think that makes sense?{nl}You broke the well working tombstone and you are saying there is no tombstone?{nl}
QUEST_UNUSED_20151022_001048	What do you want me to say?{nl}I have a headache due to the tombstone so don't talk to me.
QUEST_UNUSED_20151022_001049	It is so fortunate that the divine water I gave to you was helpful.{nl}It gives me goose bumps to think that the demons are within humans and alienate.{nl}
QUEST_UNUSED_20151022_001050	Can you tell Damijonas about this?{nl}I think they must be protecting the broken tombstone near Usas Hill.
QUEST_UNUSED_20151022_001051	I was able to protect the conspiracy of the demons because of you.{nl}I thought we may have been seperated.
QUEST_UNUSED_20151022_001052	Oh. That's right.{nl}Is there anything you found out about Albinas?{nl}
QUEST_UNUSED_20151022_001053	I am sure there are people who fell into their alienating.{nl}They are trying to break them from inside...{nl}
QUEST_UNUSED_20151022_001054	"""Anyways, thank you.{nl}I hope the goddesses bless you."""
QUEST_UNUSED_20151022_001055	Albinas has disappeared! What's going on?
QUEST_UNUSED_20151022_001056	"""What, Are you interested in the revelation?{nl}But, there arent anything besides those writings...{nl}"""
QUEST_UNUSED_20151022_001057	"""First, you bring their attention as Eminent tells you to.{nl}At the same time, let's activate the magic circle at Paramiso Battle Field in secret with me."""
QUEST_UNUSED_20151022_001058	"""You guys should be punished according to kingdom orders in principle.{nl}But, since you've saved our lives and many of our collegues have failed..{nl}"""
QUEST_UNUSED_20151022_001059	"""The safety of our colleagues comes first instead of your punishment.{nl}If you could help recapture our headquarters, then I will not question why you've entered here."""
QUEST_UNUSED_20151022_001060	I will prepare the magic with the memories of the spirits so you go to Ataka Side Road.{nl}Bring everything you can.{nl}
QUEST_UNUSED_20151022_001061	I've seen the magic circles were activating. You are okay right? {nl}How about Eminent?{nl}
QUEST_UNUSED_20151022_001062	The space which the tyrant who you've asked threw away is probably.. {nl}It is the prison that was made in the era of Kadumel era. {nl}
QUEST_UNUSED_20151022_001063	"""Restoring the magic circle was the duty of Higgs, but we have no other way since he is injured.{nl}Also everyone is getting tired due to the coldness.. I want to lend your power."""
QUEST_UNUSED_20151022_001064	You are better than Higgs.{nl}Can you help us one more time?{nl}
QUEST_UNUSED_20151022_001065	"""I met the monsters while returning with the message.{nl}I think I can move if I take little more rest, but this message should be delivered fast..{nl}"""
QUEST_UNUSED_20151022_001066	You seem competent as a swordsman.{nl}Do you have any plans to reach a higher stage?
QUEST_UNUSED_20151022_001067	"""First, show me your skills.{nl}From the Woods of the Linked Bridges, come back after defeating 10 Lapflammers and 10 Lapemans."""
QUEST_UNUSED_20151022_001068	"""If you train hard, it won't be that hard."""
QUEST_UNUSED_20151022_001069	Good.{nl}You look competent enough to progress to the next level.
QUEST_UNUSED_20151022_001070	"""Are you the one who wants to walk the way of Highlander?{nl}Then, you should pass the test.{nl}I don't have time to waste on someone who is not worthy enough."""
QUEST_UNUSED_20151022_001071	"""The main weapon of the Highlander are the two handed swords. They are strong, but you should possess enough power to hold the swords.{nl}Attack the practice pole near it and I will test how strong you are."""
QUEST_UNUSED_20151022_001072	Attack the practice pole near me.{nl}I will evaluate how strong you are.
QUEST_UNUSED_20151022_001073	"""Hmm... It seems that you won't have a big problem.{nl}If you pass one more test, I will teach the skills of Highlander."""
QUEST_UNUSED_20151022_001074	"""Your power seems to be enough.{nl}Now, I will check how you use that power well."""
QUEST_UNUSED_20151022_001075	"""With you skills, Lapflammers at Paupys Dock won't be hard.{nl}When you come back after defeating 10 of them, I will open the way of Highlander to you."""
QUEST_UNUSED_20151022_001076	Come back after defeating Lapflammers at Paupys Dock.
QUEST_UNUSED_20151022_001077	"""Your competence won't do any harm to Highlanders' fame.{nl}My father who is a master would say the same thing.{nl}On behalf of the master, I will teach you the skills of Highlander."""
QUEST_UNUSED_20151022_001078	You want to become a Peltasta? That's a wise decision.{nl}Let me ask one question to you. Do you hate the demons?
QUEST_UNUSED_20151022_001079	"""Good. The most basic requirements have been fulfilled.{nl}We, Peltastas use the shield aggressively to face against the enemies.{nl}So you must have the basic understanding of using the shield."""
QUEST_UNUSED_20151022_001080	"""I'm going to ask you for some materials for your shield.{nl}First you collect metal decorations from Lapemans.{nl}Also, gather some dry wood from an isolated worshop there."""
QUEST_UNUSED_20151022_001081	"""The Lapeman metal decorations are used for the frame, the wood for the body.{nl}You'll find both in Paupys Crossing."""
QUEST_UNUSED_20151022_001082	"""Well done.{nl}When you obtain the manual for the shield in the future, I want you to make it yourself by collecting the materials yourself."""
QUEST_UNUSED_20151022_001083	Welcome to the world of Peltastas.{nl}Let's do our best until we defeat all the demons!
QUEST_UNUSED_20151022_001084	It's always good to see new brothers and sisters.{nl}Can you help the villagers here with me?
QUEST_UNUSED_20151022_001085	"""It's not good since Lapemans are keep giving the villagers pain at Linked Bridges.{nl}In fact, I want to punish them myself.{nl}But, Rosaliya... told me that I should not leave Orsha."""
QUEST_UNUSED_20151022_001086	"""On behalf of me, please correct the bad habit of Lapezards and Lapemiter."""
QUEST_UNUSED_20151022_001087	I am just doing my important duty which I've received from Master.{nl}I am not jealous of your journey!
QUEST_UNUSED_20151022_001088	Have you completed the mission?{nl}You would be able to become a higher level Cleric.
QUEST_UNUSED_20151022_001089	I welcome any brothers or sisters who would walk the way of Krivi.{nl}My name is Mellinda.{nl}I am going to give you a simple test if you are qualified to become a Krivi. Are you okay?
QUEST_UNUSED_20151022_001090	Good. The test is simple.{nl}Receive this crystal jewel.
QUEST_UNUSED_20151022_001091	This absorbs the monster's vitalities and possess them as the energy of the flame.{nl}Hunt for the monsters outside the city and put the energies into the jewel.
QUEST_UNUSED_20151022_001092	"""When the jewel gets big, use the jewel to light up the torch beside me.{nl}With that, I will test to see if you would be able to use the energies of the torch well."""
QUEST_UNUSED_20151022_001093	"""Defeat the monsters and fill in the energies of the jewel.{nl}And when you light up the torch with the jewel, the test will be over."""
QUEST_UNUSED_20151022_001094	I think you would be able to use the energy of the torch efficiently.{nl}Welcome to the way of Krivi.
QUEST_UNUSED_20151022_001095	"""You want to walk the way of the Priest.{nl}I recognized it at once. Your competence is enough to become a Priest.{nl}It's just... to pray that your journey would be alright, we need some preparations."""
QUEST_UNUSED_20151022_001096	"""Please receive this divine water.{nl}And you just have to receive blessing from the other priests here in Orsha.{nl}Ask for the blessing to Clerik, Krivi and Bokor sub-masters."""
QUEST_UNUSED_20151022_001097	"""Ask for the blessing to Cleric, Krivi and Bokor sub-masters."""
QUEST_UNUSED_20151022_001098	"""Good. Blessing from the four priests including me would help your journey.{nl}From now on, I want you to concentrate on the roles of Priest and responsibilities."""
QUEST_UNUSED_20151022_001099	You want to step into a higher level?{nl}It's going to be a tough way. Are you still going to go? To look for the strength?
QUEST_UNUSED_20151022_001100	Good. If that's so I would have to check whether you are ready.{nl}Defeat Yognomes at 63_3 of Bracken Forest.
QUEST_UNUSED_20151022_001101	"""If you could defeat 30 of them, I would acknowledge your strength."""
QUEST_UNUSED_20151022_001102	"""You are not just bluffing, but you surely possess competence.{nl}On behalf of the master, I will teach you everything about the Swordsman."""
QUEST_UNUSED_20151022_001103	"""Did you get used to two handed swords?{nl}Now, I will teach you how you can use two handed swords well."""
QUEST_UNUSED_20151022_001104	"""But, I want to check how much you've grown up as a Highlander.{nl}Yognomes at 63_3 of Bracken Forest would fit you well. I will teach you the skills after that."""
QUEST_UNUSED_20151022_001105	Defeat 30 Yognomes at 63_3 of Bracken Forest.
QUEST_UNUSED_20151022_001106	"""Well done. As I promised to you, I will teach you high level skills that can be used with two handed swords."""
QUEST_UNUSED_20151022_001107	Have you become familiar with using shields in battles?{nl}Okay then I will teach you the skills of Peltasta now.
QUEST_UNUSED_20151022_001108	And of course we should first find out whether you would be able to handle the high level skills.{nl}Defeat the monsters at 63_3 of Bracken Forest and collect the crystals from the monsters.{nl}You can get two from the demons so please go after the demons aggressively.
QUEST_UNUSED_20151022_001109	"""But, there are restrictions.{nl}Firstly, I only admit the crystals which you've obtained while equipped with shiedls.{nl}Secondly, if you become unable to fight, the crystals you would have collected until that point will be all cancelled."""
QUEST_UNUSED_20151022_001110	"""Defeat the monsters and collect the crystals while equipped with a shield.{nl}This is to check your surviving skills.{nl}For your reference, it will be efficient to defeat the demons."""
QUEST_UNUSED_20151022_001111	"""You seem competent enough as a Peltasta.{nl}Congratulations. As I promised to you, I will teach you skills that are one level higher."""
QUEST_UNUSED_20151022_001112	"""It's easy to teach you how to use a spear, but your mind is important.{nl}There is a location to test applicants like you.{nl}The assignment is simple. It's just irritating."""
QUEST_UNUSED_20151022_001113	"""Come back after defeating 30 Yognomes from Bracken Forest 63_3.{nl}If you do so, I will acknowledge your skills.{nl}In my feelings, you would pass the test easily."""
QUEST_UNUSED_20151022_001114	"""If you have a trouble with Yognomes, then it wouldn't be that bad to look for another way."""
QUEST_UNUSED_20151022_001115	"""You want to become a Barbarian? Can you endure the training?{nl}Good. I will test you to see whether you can at least imitate some fightings.{nl}If this was our hometown, they would have passed the test. Do you want to receive it?"""
QUEST_UNUSED_20151022_001116	The most important quality of Swordsman is belligerence.{nl}You should attack anyone who shows hostility to the ones that you should protect.{nl}Think of Yognomes at 63_3 of Bracken Forest as your barriers and destroy all of them.
QUEST_UNUSED_20151022_001117	I thought you are wiry since you told me that you wanted to become a Barbarian... Are you going to give up?
QUEST_UNUSED_20151022_001118	"""There are some useful people here even in this place.{nl}Good. On behalf of Walter at Klaipeda, I will teach you the skills of Barbarian."""
QUEST_UNUSED_20151022_001119	Have you heard the stories?{nl}Some of the refugees that were coming to Orsha are hurt and fell near Lemprasa Pond.{nl}We should save them!
QUEST_UNUSED_20151022_001120	"""I've endowed the blessing onto this special ointment.{nl}Use this ointment to cure the refugees who are laid near Lemprasa Pond.{nl}After curing all refugees, I will acknowledge you as a true cleric."""
QUEST_UNUSED_20151022_001121	"""If it was not the order of the master, I would have gone there.{nl}I have no one to trust except for you."""
QUEST_UNUSED_20151022_001122	It is so fortunate that a big problem didn't occur to them.{nl}It's all because of the devotion that you've shown to us.{nl}You look competent enough to progress to the last stage of Cleric.
QUEST_UNUSED_20151022_001123	I think the time has come to tell your religious belief to the goddesses and receive the blessings.{nl}Pray to the goddesses near Orsha and dedicate these goods.
QUEST_UNUSED_20151022_001124	"""Go to the statues of the goddesses at Lemprasa Pond, Linked Bridges, and Paupys Dock.{nl}Return after dedicating the goods to all statues."""
QUEST_UNUSED_20151022_001125	There are no official steps when it comes to offerings.{nl}They're something you do when you want to repent of past mistakes.
QUEST_UNUSED_20151022_001126	Well done. Aren't there any broken parts of the statues of the goddesses?{nl}You now have reached a higher stage.
QUEST_UNUSED_20151022_001127	"""I am taking care of the refugees of Orsha with other priests.{nl}But, the herbs that should be used for the ointment has run out.{nl}The time has come to test for your advancement so I will give you a small assignment."""
QUEST_UNUSED_20151022_001128	"""I am looking for three kinds of herbs.{nl}Obtain the herbs from 63_1, 63_2 and 63_3 of Bracken Forest."""
QUEST_UNUSED_20151022_001129	You will see the first herb when you dig into the pile of tree leaves near the exit which leads to the next territory.{nl}The second herb is growing on the region located below.{nl}The third herb has the yellow flower so you will easily find it.
QUEST_UNUSED_20151022_001130	"""The effects of the three herbs are not that different from each other.{nl}As I told you, don't forget this also tests for your advancement."""
QUEST_UNUSED_20151022_001131	"""Let's see... It surely is.{nl}When your good deeds accumulate like this, you will feel that your religious belief gets deeper.{nl}You've passed the test. From now on, you will be learning higher level Priest skills."""
QUEST_UNUSED_20151022_001132	"""Are you the one who wants to become a Bokor?{nl}Welcome. In order to become a Bokor, there is a test you must pass.{nl}Have you heard about it?{nl}"""
QUEST_UNUSED_20151022_001133	Yes! You should have made Bokor dolls in order for you to be called a Bokor.{nl}Make the doll with this manual.
QUEST_UNUSED_20151022_001134	"""Long time ago, the Master also became a Bokor after making Shaman Dolls.{nl}It is the ritual which has the history and the tradition."""
QUEST_UNUSED_20151022_001135	"""This Shaman Doll has the highest grade among the dolls which I've seen before!{nl}You seem to possess the attributes of Bokor.{nl}Now, you are the Bokor. Welcome!"""
QUEST_UNUSED_20151022_001136	"""You want to become a Dievdirbys? Of course, I welcome you.{nl}The way of Dievdirbys is open to everyone.{nl}Just... If you could listen to one of my little requests."""
QUEST_UNUSED_20151022_001137	The end of the graving chisel has run out.{nl}I guess we should ask the blacksmith in Orsha.{nl}Tell him that it is my request and get the new graving chisel.
QUEST_UNUSED_20151022_001138	I am sorry. I am counting on you until Orsha.{nl}I have matters to do here.
QUEST_UNUSED_20151022_001139	"""What's the matter? Ah.. I remember that Dievdirbys girl.{nl}But, what should I do. The chisel and the materials are all ran oout."""
QUEST_UNUSED_20151022_001140	I hope you can get the materials.
QUEST_UNUSED_20151022_001141	"""There will be times when you discover the chunks that are accumulated with metals from Yognomes at 63_3 of Bracken Forest.{nl}If you could bring those, I will make an useful graving chisel for you."""
QUEST_UNUSED_20151022_001142	The metals that are accumulated in the bodies of the monsters get crumpled together at 63_3 of Bracken Forest.{nl}Defeat Yognomes and collect the metal chunks.
QUEST_UNUSED_20151022_001143	"""Yes. This would be enough.{nl}Crafting is not that hard so if you wait a bit, I will make it for you."""
QUEST_UNUSED_20151022_001144	It is almost done.
QUEST_UNUSED_20151022_001145	It is a decent object so you would be able to stand for some time.{nl}Give it to him.
QUEST_UNUSED_20151022_001146	Ask him to come by Orsha sometimes.
QUEST_UNUSED_20151022_001147	"""Damn... I knew that it was taking longer than expected, but I didn't know that you made such efforts.{nl}Thank you. Of course, you are a Dievdirbys from now on."""
QUEST_UNUSED_20151022_001148	You've improved a lot! Everyone would acknowledge your skills.{nl}It's just.. you fall little short according to my father's standards.{nl}I will help you to reach a higher stage.
QUEST_UNUSED_20151022_001149	"""Good. Let's see one more time if you are competent enough to learn higher level skills.{nl}I will see how you handle existing skills well.{nl}I don't care which monster, just defeat any monster using Highlander's skills."""
QUEST_UNUSED_20151022_001150	Defeating monsters with the skills of Highlander. I think it's easy for the last assignment.
QUEST_UNUSED_20151022_001151	I've seen you use the skills which you previously learned really well.{nl}You won't have a problem learning higher level skills without any problem.{nl}I think I can say to anyone proudly that I am the one who taught you the skills.
QUEST_UNUSED_20151022_001152	"""You would easily defeat any kinds of demons.{nl}But, in order to defeat the real bad demons, you will have to try hard.{nl}I will open the true way of Peltasta for you."""
QUEST_UNUSED_20151022_001153	"""But, you should at least pass the minimum requirement.{nl}Come back after defeating Chapparitions from Karolis Springs."""
QUEST_UNUSED_20151022_001154	Chapparitions are not hard if we think about the courage that you've shown us so far.{nl}Don't worry too much.
QUEST_UNUSED_20151022_001155	Very good! I can now acknowledge you as a fellow soldier.{nl}I should report to the master individually.{nl}I will show you the true power of Peltastas with my authority.
QUEST_UNUSED_20151022_001156	Your growth is really surprising. I can feel something different in you.{nl}I am sure you will become stronger. Are you ready to proceed to the next level?
QUEST_UNUSED_20151022_001157	There is a monster which I faced long time ago.{nl}It ran away and I was worried that it may hurt the other people.
QUEST_UNUSED_20151022_001158	"""There is a rumor that he appeared again.{nl}Please kill it on behalf of me.{nl}And as a proof, please bring me the chisel that is on the body of the monster."""
QUEST_UNUSED_20151022_001159	Defeat Sparnasman at 64_2 of Bracken Monastery and bring me the tip of my spear.
QUEST_UNUSED_20151022_001160	That is definitely the tip of my spear wihich was on the body of the monster.{nl}I can proudly say that our competent Hopelite defeated it.
QUEST_UNUSED_20151022_001161	Hmm... You've become very strong.{nl}I didn't know that you've completed the training that hard. You will be able to learn the skills of the next stage.
QUEST_UNUSED_20151022_001162	"""Of course, I can't just teach you for free. Prove the strength you have!{nl}Without any enhancement effects on your body, come back after defeating the monsters at Feretory Hills."""
QUEST_UNUSED_20151022_001163	Prove the strength of the sword.
QUEST_UNUSED_20151022_001164	You are way more useful than I expected.{nl}My brother would be glad to know that a competant lad like you became a Barbarian.
QUEST_UNUSED_20151022_001165	You know well about the structure of the shield.{nl}You can come to me anyime to learn.
QUEST_UNUSED_20151022_001166	Cataphract. {nl}I don't know if it would fit you well.
QUEST_UNUSED_20151022_001167	I like your spirit.{nl}Try defeating Beast-type monsters at Feretory Hills.
QUEST_UNUSED_20151022_001168	"""Since Medzio Diena, the monsters that inflict the most harm are the Beast-type.{nl}Defeat the Beast-type monsters at Feretory Hills."""
QUEST_UNUSED_20151022_001169	I think you would be able to reach a higher level Krivis.{nl}Do you want to receive the test?
QUEST_UNUSED_20151022_001170	"""With this jewel, please go to Feretory Hills.{nl}Make scars on the monsters and use the power of the jewel to purify the monsters.{nl}When you do that, ashes will remain. Please gather them."""
QUEST_UNUSED_20151022_001171	Don't worry. It is the sacred flame so it would not harm you.
QUEST_UNUSED_20151022_001172	Your competence has been proven as a result.{nl}Congratulations on your entrance to the last stage of Krivis.{nl}I want you to help the ones who are stuggling with the power you have.
QUEST_UNUSED_20151022_001173	"""Now, it is time to leave for a far place and spread the blessing of the goddesses.{nl}But, we never know what kind of dangers are ahead of us.{nl}Especially the times like nowadays."""
